[
	{
		"id": "01a0889d-8ae8-7c8a-b964-0ead5f668a5a",
		"user": "01a0889d-8ae9-7ccd-b01b-9dc927862f2c",
		"title": "Программа: БАЗА + ПУЛ",
		"goals": {
			"primary": [
				"glutes",
				"lumbar_stiffness",
				"hip_mobility",
				"body_composition"
			],
			"secondary": [
				"strength",
				"endurance",
				"flexibility"
			]
		},
		"contraindications": {
			"axial_load": true,
			"loaded_lumbar_flexion": true,
			"loaded_lumbar_extension": true,
			"free_weight_kg_max": 10
		},
		"schedule": {
			"sessions_per_week": 3,
			"rotation_weeks": 2,
			"session_budget_min": 70
		},
		"timing": {
			"work_sec_per_set": 45,
			"rest_sec_strength": 70,
			"rest_sec_accessory": 60,
			"transition_sec": 45,
			"hold_rest_sec": 10,
			"warmup_general_min": 5
		},
		"progression": {
			"base": "двойная прогрессия: все подходы по 15 при RPE 8 → следующая ступень стека, снова с 12",
			"pool": "у каждого упражнения свой вес в дневнике; при возврате через 2 недели — тот же вес, попытка +1 повтор",
			"isometric": "удержание 10с × 5 → 10с × 8 → 15с × 5, только когда предыдущая ступень проходит без дрожи",
			"stop_rule": "покалывание, онемение, прострел в ногу — прекратить и к врачу"
		},
		"volume_targets": {
			"glutes": {
				"min": 12,
				"max": 22
			},
			"quads": {
				"min": 6,
				"max": 14
			},
			"hamstrings": {
				"min": 6,
				"max": 14
			},
			"back": {
				"min": 6,
				"max": 14
			},
			"chest": {
				"min": 4,
				"max": 12
			},
			"delts": {
				"min": 4,
				"max": 12
			},
			"calves": {
				"min": 2,
				"max": 8
			},
			"biceps": {
				"min": 3,
				"max": 10
			},
			"triceps": {
				"min": 3,
				"max": 10
			},
			"rear_delt": {
				"min": 2,
				"max": 8
			},
			"rotators": {
				"min": 1,
				"max": 6
			},
			"adductors": {
				"min": 1,
				"max": 6
			}
		},
		"hip_planes": [
			"flexion",
			"extension",
			"abduction",
			"adduction",
			"internal_rot",
			"external_rot"
		],
		"outside_gym": {
			"walking": {
				"name": "Ходьба в разговорном темпе",
				"min_per_session": 45,
				"sessions_per_week": 4,
				"intensity": "moderate"
			},
			"mobility_home": {
				"name": "Подвижность дома",
				"min_per_day": 10,
				"days_per_week": 7
			}
		},
		"pairing": [
			{
				"slot": "01a0889d-873e-70db-a0e9-569de5c6b01c",
				"exercises": [
					"01a0889d-8a1b-7fac-949b-a7bcb6734828",
					"01a0889d-8ab1-75e0-90b3-a29527a6da8b"
				]
			},
			{
				"slot": "01a0889d-873f-78ac-885d-4cfb346f3012",
				"exercises": [
					"01a0889d-8a54-71d4-b662-65fdfbdbab06",
					"01a0889d-7b5f-7e81-aad8-61d8fb833f06"
				]
			},
			{
				"slot": "01a0889d-873c-7719-b74b-79b9ab0d636c",
				"exercises": [
					"01a0889d-7fdd-75b8-a1b5-a8f1e83119c4",
					"01a0889d-8a85-7cce-bea5-74aa067dd054"
				]
			},
			{
				"slot": "01a0889d-873d-7eaf-8e85-1cfcf5f1f7da",
				"exercises": [
					"01a0889d-8a85-7cce-bea5-74aa067dd054",
					"01a0889d-7fdd-75b8-a1b5-a8f1e83119c4"
				]
			}
		],
		"sections": [
			{
				"id": "01a0889d-872e-7daf-926a-251793bd6ecc",
				"slug": "warmup_cardio",
				"title": "Разогрев",
				"mode": "cardio",
				"bank": "01a0889d-847c-7e2e-9bb7-6fcc9d121745",
				"slots": [
					{
						"id": "01a0889d-847f-701f-9ebc-a111f71526ed",
						"kind": "pool",
						"label": "Сердце, сосуды, лёгкие · кардиореспираторный контур",
						"exercises": [
							"01a0889d-8480-7d66-9472-7697e421694e",
							"01a0889d-84b9-7181-b1e2-b2f7c39d2325",
							"01a0889d-84f0-7ce2-b18a-07781b7e5ad8",
							"01a0889d-8529-73de-a809-069fe4a71570",
							"01a0889d-8564-7117-bad1-a50274ffdb14",
							"01a0889d-859e-7209-af77-9fe5ed9dbb2b",
							"01a0889d-85d4-7c90-8bce-a7823991ae4c",
							"01a0889d-860b-7365-a9f3-abda23abb010",
							"01a0889d-8647-7849-84bd-7b216747f902",
							"01a0889d-8687-7f3e-8b99-f32e7765f019",
							"01a0889d-86c4-78d8-98e6-ae1b56f28f03",
							"01a0889d-86fc-7b62-a9ff-c30e349f4fb9"
						],
						"pick": 1,
						"allow_repeat": true,
						"sec_each": 260
					}
				]
			},
			{
				"id": "01a0889d-873a-76b7-a022-50d04fda4a11",
				"slug": "warmup",
				"title": "Разминка",
				"mode": "dynamic",
				"bank": "01a0889d-4422-7136-b68e-84808d6000c0",
				"slots": [
					{
						"id": "01a0889d-872f-7c97-9105-8f427bb3edcf",
						"kind": "pool",
						"label": "Шея · шейный отдел",
						"exercises": [
							"01a0889d-3851-7468-b94f-0e0365b0548b",
							"01a0889d-388b-77b4-ae3d-5e4644a203e9",
							"01a0889d-38b8-7e11-bfa1-6cf8cc29fbfa",
							"01a0889d-38e3-70f2-9c37-84262503f144"
						],
						"pick": 4,
						"allow_repeat": true,
						"sec_each": 20
					},
					{
						"id": "01a0889d-8730-717e-a980-b24e4bdbfd97",
						"kind": "pool",
						"label": "Плечевой пояс · плечевой сустав",
						"exercises": [
							"01a0889d-391e-75dd-97d5-d44c84dabdb6",
							"01a0889d-395c-79ac-b96c-32eaee32db30",
							"01a0889d-398d-7691-8a6d-1e3eb19f4aed",
							"01a0889d-39bd-7a4f-b780-4e3b89cb7b32",
							"01a0889d-39ef-76d8-a50f-4f7d6748285d",
							"01a0889d-3a1d-7012-acf6-cb7e0ada0917"
						],
						"pick": 1,
						"allow_repeat": true,
						"sec_each": 22
					},
					{
						"id": "01a0889d-8731-78f9-a7c9-b820acdfb833",
						"kind": "pool",
						"label": "Плечевой пояс · лопатки",
						"exercises": [
							"01a0889d-3a4a-7dc3-a71c-ce027250e73f",
							"01a0889d-3a79-7c51-8e10-183934b4a283",
							"01a0889d-3aaa-7b09-8435-b7a9d61e2a5d",
							"01a0889d-3adc-74a3-89cd-0159f4eba342"
						],
						"pick": 1,
						"allow_repeat": true,
						"sec_each": 18
					},
					{
						"id": "01a0889d-8732-71e2-9f9b-b639c7220bea",
						"kind": "pool",
						"label": "Плечевой пояс · локоть",
						"exercises": [
							"01a0889d-3b0c-77b6-91b9-6a830b98c88e",
							"01a0889d-3b3f-73c9-908c-9750a1ef480d",
							"01a0889d-3b71-77ec-b668-66d4816a8cb3",
							"01a0889d-3ba3-77d7-8e85-0a1881e54f35"
						],
						"pick": 1,
						"allow_repeat": true,
						"sec_each": 16
					},
					{
						"id": "01a0889d-8733-76c2-b02c-3b518f27dec0",
						"kind": "pool",
						"label": "Плечевой пояс · лучезапястный сустав",
						"exercises": [
							"01a0889d-3bd5-7c65-b91b-2cb1b4631b08",
							"01a0889d-3c08-7bc8-9a33-6b68bef7b4c2",
							"01a0889d-3c3e-78da-b3f1-1c81d8bcf9a4",
							"01a0889d-3c72-735f-9c50-a693bdf513a5"
						],
						"pick": 1,
						"allow_repeat": true,
						"sec_each": 16
					},
					{
						"id": "01a0889d-8734-7fb0-87c6-a99e99bc15c2",
						"kind": "pool",
						"label": "Плечевой пояс · пальцы",
						"exercises": [
							"01a0889d-3ca5-750e-a8ed-9c678b9612de",
							"01a0889d-3cd6-7b2f-9c44-9dc55f3ca5d5",
							"01a0889d-3d02-73a1-857e-98042e701fec",
							"01a0889d-3d31-7ae9-8b4c-a837208dd69c"
						],
						"pick": 1,
						"allow_repeat": true,
						"sec_each": 14
					},
					{
						"id": "01a0889d-8735-718c-87a7-8b0797242cf0",
						"kind": "pool",
						"label": "Грудь, спина · грудной отдел",
						"exercises": [
							"01a0889d-3d57-7d2f-9d48-9e98815640da",
							"01a0889d-3d86-7082-acbd-3139a7db005a",
							"01a0889d-3db8-7c1e-ac6f-870acf94838c",
							"01a0889d-3de7-7c2a-83c4-c4013124a6b5",
							"01a0889d-3e11-7444-a128-c6ebdb38c260",
							"01a0889d-3e42-7641-a915-b1077b617096",
							"01a0889d-3e70-7ca6-9493-ec14d4969b7f",
							"01a0889d-3e98-7090-8f79-4b2c77960c39"
						],
						"pick": 1,
						"allow_repeat": true,
						"sec_each": 27
					},
					{
						"id": "01a0889d-8736-7b7d-9973-773e9591810a",
						"kind": "pool",
						"label": "Поясница · пояснично-тазовый",
						"exercises": [
							"01a0889d-3ec6-716a-8353-99b66051b722",
							"01a0889d-3ef0-753e-9061-481ae9a13492",
							"01a0889d-3f1b-70e8-813f-6f2fa4c88a22",
							"01a0889d-3f51-7977-8c75-aa7dc14b23aa"
						],
						"pick": 1,
						"allow_repeat": true,
						"sec_each": 22
					},
					{
						"id": "01a0889d-8737-7bcd-b667-27545b9d5d1c",
						"kind": "pool",
						"label": "Бёдра · тазобедренный сустав",
						"exercises": [
							"01a0889d-3f7b-7862-a70b-4a98a4583aa8",
							"01a0889d-3fab-7eb9-b80e-57ecfea86d84",
							"01a0889d-3fd9-730d-b479-4c5479c7e017",
							"01a0889d-4017-794e-95cd-a5be2c3ca68c",
							"01a0889d-4045-7b8f-b335-9caba7dc641c",
							"01a0889d-406f-72ba-aa08-832bedfd1969",
							"01a0889d-40a2-7b1f-9f76-e710696cce36",
							"01a0889d-40d8-78d7-8459-1a5b9fed6e2d",
							"01a0889d-40fc-766b-b2cd-df089ead2989",
							"01a0889d-4129-78af-966c-c9165d4982e2"
						],
						"pick": 1,
						"allow_repeat": true,
						"sec_each": 38
					},
					{
						"id": "01a0889d-8738-7f90-afdd-0a65ee001688",
						"kind": "pool",
						"label": "Колени · коленный сустав",
						"exercises": [
							"01a0889d-4168-7358-9cf8-238ed32e3d3f",
							"01a0889d-41a4-7be9-b8fa-1a06ea69a4f3",
							"01a0889d-41d3-7170-b153-ca7c147d77a1",
							"01a0889d-4207-7e5f-ba31-ccbb6d5108ab",
							"01a0889d-4239-70cb-9cd7-b1cabd2d4628",
							"01a0889d-4262-7723-9864-4cd66d453e1b",
							"01a0889d-428e-7bce-ab0b-12f417c981bf"
						],
						"pick": 1,
						"allow_repeat": true,
						"sec_each": 32
					},
					{
						"id": "01a0889d-8739-7de7-92a7-0ddcba5efdfe",
						"kind": "pool",
						"label": "Стопы · голеностоп и стопа",
						"exercises": [
							"01a0889d-42be-7dce-901c-8ef6e01ecd2a",
							"01a0889d-42f2-79aa-a864-8d1bc89db223",
							"01a0889d-4324-7068-8563-92732a0cd2e6",
							"01a0889d-434f-7308-8b38-628c4547b05a",
							"01a0889d-437b-755e-96b4-ac8d34254410",
							"01a0889d-43a6-712f-8a97-de928717f59e",
							"01a0889d-43d3-7a68-9264-db943a5ad42a",
							"01a0889d-43f3-79c8-a44d-0fa828570ed3"
						],
						"pick": 1,
						"allow_repeat": true,
						"sec_each": 21
					}
				]
			},
			{
				"id": "01a0889d-8741-7900-815c-5b5db0b02f9c",
				"slug": "strength",
				"title": "Силовой",
				"mode": "loaded",
				"bank": "01a0889d-5fff-78b5-82a8-fb69c70c4ce8",
				"slots": [
					{
						"id": "01a0889d-873b-7778-9744-c1523e4131e9",
						"kind": "base",
						"label": "База",
						"exercises": [